{"base_campaign":{"path":"/srv/sparkinterval-operator/config/h100-production-template.json","sha256":"0000000000000000000000000000000000000000000000000000000000000000","size_bytes":0},"build":{"build_admission":{"reason":"Populate only after reviewing exact Azure x86_64 Python, NVCC, host C++, executable, source, closure, deployment, and job-derivation identities.","status":"unconfigured"},"hardened_goldbach_source_root":"/srv/sparkinterval-source/goldbach-gpu-hardened","host_cxx":{"path":"/usr/bin/g++","sha256":"0000000000000000000000000000000000000000000000000000000000000000","size_bytes":0},"nvcc":{"path":"/usr/local/cuda/bin/nvcc","sha256":"0000000000000000000000000000000000000000000000000000000000000000","size_bytes":0},"plan_predecessor_export":{"path":"/srv/sparkinterval-operator/tg-portfolio/exports/lowered-binary-plan.tar","sha256":"0000000000000000000000000000000000000000000000000000000000000000","size_bytes":0},"python":{"path":"/usr/bin/python3","sha256":"0000000000000000000000000000000000000000000000000000000000000000","size_bytes":0}},"kind":"sparkinterval.azure.h100.goldbach10pow27-materializer-site.v1","output_root":"/srv/sparkinterval-operator/materialized/goldbach10pow27-h100","schema_version":1}
